{"$schema":"https://json-schema.org/draft/2020-12/schema","$id":"https://strange.studio/schemas/runtime-contract.schema.json","title":"OIOS Runtime Contract","type":"object","required":["engine","version","status","capabilities","events","states"],"properties":{"engine":{"type":"string","minLength":1},"version":{"type":"string","pattern":"^(0|[1-9]\\d*)\\.(0|[1-9]\\d*)\\.(0|[1-9]\\d*)(-[0-9A-Za-z.-]+)?(\\+[0-9A-Za-z.-]+)?$"},"status":{"enum":["declared","implemented","runtime-verified","deprecated"]},"capabilities":{"type":"array","uniqueItems":true,"items":{"type":"string"}},"events":{"type":"array","uniqueItems":true,"items":{"type":"string"}},"states":{"type":"array","uniqueItems":true,"items":{"type":"string"}},"apis":{"type":"array","uniqueItems":true,"items":{"type":"string"}},"evidencePolicy":{"type":"string"}},"additionalProperties":false}
