{"engine":"quest-engine","version":"1.0.0","status":"declared","capabilities":["quest-definition","quest-workflow-mapping","prerequisite-checking","completion-evidence"],"events":["QuestCreated","QuestStarted","QuestCompleted","QuestBlocked"],"states":["READY","ACTIVE","WAITING","BLOCKED","FAILED","COMPLETE"],"apis":["define","validate","map-workflow","record-outcome"],"evidencePolicy":"Declared capabilities must be checked against actual engine behavior."}
