{"engine":"evidence-engine","version":"1.0.0","status":"declared","capabilities":["artifact-hashing","evidence-collection","provenance-linking","integrity-validation","evidence-query"],"events":["EvidenceCollected","EvidenceValidated","EvidenceRejected"],"states":["COLLECTED","VALIDATED","REJECTED","INCOMPLETE"],"apis":["collect","validate","query","verify-integrity"],"evidencePolicy":"Evidence is not trust and cannot issue certificates."}
