{"engine":"execution-engine","version":"1.0.0","status":"declared","capabilities":["sandbox-execution","resource-limits","execution-traces","observable-outcomes"],"events":["ExecutionStarted","ExecutionCompleted","ExecutionTimedOut","ExecutionRejected"],"states":["QUEUED","RUNNING","COMPLETED","FAILED","TIMED_OUT","REJECTED"],"apis":["execute","cancel","get-trace","get-report"],"evidencePolicy":"Sandbox safety requires implementation-specific tests."}
