{"engine":"workflow-engine","version":"1.0.0","status":"declared","capabilities":["workflow-graph","transition-guard","retry-policy","execution-trace"],"events":["WorkflowCreated","WorkflowStarted","WorkflowCompleted","WorkflowBlocked","WorkflowFailed"],"states":["READY","ACTIVE","WAITING","BLOCKED","FAILED","RETRYING","COMPLETE"],"apis":["create","validate-graph","transition","inspect"],"evidencePolicy":"Compatibility requires implementation and runtime test evidence."}
