{"engine":"architecture-engine","version":"1.0.0","status":"declared","capabilities":["safe-manifest-parse","schema-validation","ontology-validation","cross-field-validation","projection-round-trip","resource-validation","workflow-graph-validation"],"events":["ArchitecturePackLoaded","ArchitectureValidationStarted","ArchitectureValidationCompleted","ArchitectureValidationFailed"],"states":["UNVERIFIED","VALIDATING","VALID","INVALID","BLOCKED"],"apis":["parse-manifest","validate-pack","build-report"],"evidencePolicy":"Target contract only; implementation is not confirmed."}
